Country name,Official state name,Sovereignty,iso2
Islamic Republic of Afghanistan Afghanistan ,The Islamic Republic of Afghanistan ,UN member state ,AF 
Albania Albania ,The Republic of Albania ,UN member state ,AL 
Algeria Algeria ,The People's Democratic Republic of Algeria ,UN member state ,DZ 
Andorra Andorra ,The Principality of Andorra ,UN member state ,AD 
Angola Angola ,The Republic of Angola ,UN member state ,AO 
Antigua and Barbuda Antigua and Barbuda ,Antigua and Barbuda ,UN member state ,AG 
Argentina Argentina ,The Argentine Republic ,UN member state ,AR 
Armenia Armenia ,The Republic of Armenia ,UN member state ,AM 
Australia Australia [c] ,The Commonwealth of Australia ,UN member state ,AU 
Austria Austria ,The Republic of Austria ,UN member state ,AT 
Azerbaijan Azerbaijan ,The Republic of Azerbaijan ,UN member state ,AZ 
The Bahamas Bahamas (the) ,The Commonwealth of The Bahamas ,UN member state ,BS 
Bahrain Bahrain ,The Kingdom of Bahrain ,UN member state ,BH 
Bangladesh Bangladesh ,The People's Republic of Bangladesh ,UN member state ,BD 
Barbados Barbados ,Barbados ,UN member state ,BB 
Belarus Belarus ,The Republic of Belarus ,UN member state ,BY 
Belgium Belgium ,The Kingdom of Belgium ,UN member state ,BE 
Belize Belize ,Belize ,UN member state ,BZ 
Benin Benin ,The Republic of Benin ,UN member state ,BJ 
Bhutan Bhutan ,The Kingdom of Bhutan ,UN member state ,BT 
Bolivia Bolivia (Plurinational State of) ,The Plurinational State of Bolivia ,UN member state ,BO 
Bosnia and Herzegovina Bosnia and Herzegovina ,Bosnia and Herzegovina ,UN member state ,BA 
Botswana Botswana ,The Republic of Botswana ,UN member state ,BW 
Brazil Brazil ,The Federative Republic of Brazil ,UN member state ,BR 
Brunei Brunei Darussalam [f] ,"The Nation of Brunei, the Abode of Peace ",UN member state ,BN 
Bulgaria Bulgaria ,The Republic of Bulgaria ,UN member state ,BG 
Burkina Faso Burkina Faso ,Burkina Faso ,UN member state ,BF 
Burundi Burundi ,The Republic of Burundi ,UN member state ,BI 
Cape Verde Cabo Verde [g] ,The Republic of Cabo Verde ,UN member state ,CV 
Cambodia Cambodia ,The Kingdom of Cambodia ,UN member state ,KH 
Cameroon Cameroon ,The Republic of Cameroon ,UN member state ,CM 
Canada Canada ,Canada ,UN member state ,CA 
Central African Republic Central African Republic (the) ,The Central African Republic ,UN member state ,CF 
Chad Chad ,The Republic of Chad ,UN member state ,TD 
Chile Chile ,The Republic of Chile ,UN member state ,CL 
China China ,The People's Republic of China ,UN member state ,CN 
Colombia Colombia ,The Republic of Colombia ,UN member state ,CO 
Comoros Comoros (the) ,The Union of the Comoros ,UN member state ,KM 
Democratic Republic of the Congo Congo (the Democratic Republic of the) ,The Democratic Republic of the Congo ,UN member state ,CD 
Republic of the Congo Congo (the) [h] ,The Republic of the Congo ,UN member state ,CG 
Costa Rica Costa Rica ,The Republic of Costa Rica ,UN member state ,CR 
Ivory Coast Côte d'Ivoire [i] ,The Republic of Côte d'Ivoire ,UN member state ,CI 
Croatia Croatia ,The Republic of Croatia ,UN member state ,HR 
Cuba Cuba ,The Republic of Cuba ,UN member state ,CU 
Cyprus Cyprus ,The Republic of Cyprus ,UN member state ,CY 
Czech Republic Czechia [j] ,The Czech Republic ,UN member state ,CZ 
Denmark Denmark ,The Kingdom of Denmark ,UN member state ,DK 
Djibouti Djibouti ,The Republic of Djibouti ,UN member state ,DJ 
Dominica Dominica ,The Commonwealth of Dominica ,UN member state ,DM 
Dominican Republic Dominican Republic (the) ,The Dominican Republic ,UN member state ,DO 
Ecuador Ecuador ,The Republic of Ecuador ,UN member state ,EC 
Egypt Egypt ,The Arab Republic of Egypt ,UN member state ,EG 
El Salvador El Salvador ,The Republic of El Salvador ,UN member state ,SV 
Equatorial Guinea Equatorial Guinea ,The Republic of Equatorial Guinea ,UN member state ,GQ 
Eritrea Eritrea ,The State of Eritrea ,UN member state ,ER 
Estonia Estonia ,The Republic of Estonia ,UN member state ,EE 
Eswatini Eswatini [k] ,The Kingdom of Eswatini ,UN member state ,SZ 
Ethiopia Ethiopia ,The Federal Democratic Republic of Ethiopia ,UN member state ,ET 
Fiji Fiji ,The Republic of Fiji ,UN member state ,FJ 
Finland Finland ,The Republic of Finland ,UN member state ,FI 
France France [m] ,The French Republic ,UN member state ,FR 
Gabon Gabon ,The Gabonese Republic ,UN member state ,GA 
The Gambia Gambia (the) ,The Republic of The Gambia ,UN member state ,GM 
Georgia (country) Georgia ,Georgia ,UN member state ,GE 
Germany Germany ,The Federal Republic of Germany ,UN member state ,DE 
Ghana Ghana ,The Republic of Ghana ,UN member state ,GH 
Greece Greece ,The Hellenic Republic ,UN member state ,GR 
Grenada Grenada ,Grenada ,UN member state ,GD 
Guatemala Guatemala ,The Republic of Guatemala ,UN member state ,GT 
Guinea Guinea ,The Republic of Guinea ,UN member state ,GN 
Guinea-Bissau Guinea-Bissau ,The Republic of Guinea-Bissau ,UN member state ,GW 
Guyana Guyana ,The Co-operative Republic of Guyana ,UN member state ,GY 
Haiti Haiti ,The Republic of Haiti ,UN member state ,HT 
Honduras Honduras ,The Republic of Honduras ,UN member state ,HN 
Hungary Hungary ,Hungary ,UN member state ,HU 
Iceland Iceland ,Iceland ,UN member state ,IS 
India India ,The Republic of India ,UN member state ,IN 
Indonesia Indonesia ,The Republic of Indonesia ,UN member state ,ID 
Iran Iran (Islamic Republic of) ,The Islamic Republic of Iran ,UN member state ,IR 
Iraq Iraq ,The Republic of Iraq ,UN member state ,IQ 
Republic of Ireland Ireland ,Ireland ,UN member state ,IE 
Israel Israel ,The State of Israel ,UN member state ,IL 
Italy Italy ,The Italian Republic ,UN member state ,IT 
Jamaica Jamaica ,Jamaica ,UN member state ,JM 
Japan Japan ,Japan ,UN member state ,JP 
Jordan Jordan ,The Hashemite Kingdom of Jordan ,UN member state ,JO 
Kazakhstan Kazakhstan ,The Republic of Kazakhstan ,UN member state ,KZ 
Kenya Kenya ,The Republic of Kenya ,UN member state ,KE 
Kiribati Kiribati ,The Republic of Kiribati ,UN member state ,KI 
North Korea Korea (the Democratic People's Republic of) [p] ,The Democratic People's Republic of Korea ,UN member state ,KP 
South Korea Korea (the Republic of) [q] ,The Republic of Korea ,UN member state ,KR 
Kuwait Kuwait ,The State of Kuwait ,UN member state ,KW 
Kyrgyzstan Kyrgyzstan ,The Kyrgyz Republic ,UN member state ,KG 
Laos Lao People's Democratic Republic (the) [r] ,The Lao People's Democratic Republic ,UN member state ,LA 
Latvia Latvia ,The Republic of Latvia ,UN member state ,LV 
Lebanon Lebanon ,The Lebanese Republic ,UN member state ,LB 
Lesotho Lesotho ,The Kingdom of Lesotho ,UN member state ,LS 
Liberia Liberia ,The Republic of Liberia ,UN member state ,LR 
Libya Libya ,The State of Libya ,UN member state ,LY 
Liechtenstein Liechtenstein ,The Principality of Liechtenstein ,UN member state ,LI 
Lithuania Lithuania ,The Republic of Lithuania ,UN member state ,LT 
Luxembourg Luxembourg ,The Grand Duchy of Luxembourg ,UN member state ,LU 
North Macedonia North Macedonia [t] ,The Republic of North Macedonia[12] ,UN member state ,MK 
Madagascar Madagascar ,The Republic of Madagascar ,UN member state ,MG 
Malawi Malawi ,The Republic of Malawi ,UN member state ,MW 
Malaysia Malaysia ,Malaysia ,UN member state ,MY 
Maldives Maldives ,The Republic of Maldives ,UN member state ,MV 
Mali Mali ,The Republic of Mali ,UN member state ,ML 
Malta Malta ,The Republic of Malta ,UN member state ,MT 
Marshall Islands Marshall Islands (the) ,The Republic of the Marshall Islands ,UN member state ,MH 
Mauritania Mauritania ,The Islamic Republic of Mauritania ,UN member state ,MR 
Mauritius Mauritius ,The Republic of Mauritius ,UN member state ,MU 
Mexico Mexico ,The United Mexican States ,UN member state ,MX 
Federated States of Micronesia Micronesia (Federated States of) ,The Federated States of Micronesia ,UN member state ,FM 
Moldova Moldova (the Republic of) ,The Republic of Moldova ,UN member state ,MD 
Monaco Monaco ,The Principality of Monaco ,UN member state ,MC 
Mongolia Mongolia ,Mongolia ,UN member state ,MN 
Montenegro Montenegro ,Montenegro ,UN member state ,ME 
Morocco Morocco ,The Kingdom of Morocco ,UN member state ,MA 
Mozambique Mozambique ,The Republic of Mozambique ,UN member state ,MZ 
Myanmar Myanmar [u] ,The Republic of the Union of Myanmar ,UN member state ,MM 
Namibia Namibia ,The Republic of Namibia ,UN member state ,NA 
Nauru Nauru ,The Republic of Nauru ,UN member state ,NR 
Nepal Nepal ,The Federal Democratic Republic of Nepal ,UN member state ,NP 
"Netherlands Netherlands, Kingdom of the ",The Kingdom of the Netherlands ,UN member state ,NL 
New Zealand New Zealand ,New Zealand ,UN member state ,NZ 
Nicaragua Nicaragua ,The Republic of Nicaragua ,UN member state ,NI 
Niger Niger (the) ,The Republic of the Niger ,UN member state ,NE 
Nigeria Nigeria ,The Federal Republic of Nigeria ,UN member state ,NG 
Norway Norway ,The Kingdom of Norway ,UN member state ,NO 
Oman Oman ,The Sultanate of Oman ,UN member state ,OM 
Pakistan Pakistan ,The Islamic Republic of Pakistan ,UN member state ,PK 
Palau Palau ,The Republic of Palau ,UN member state ,PW 
Panama Panama ,The Republic of Panamá ,UN member state ,PA 
Papua New Guinea Papua New Guinea ,The Independent State of Papua New Guinea ,UN member state ,PG 
Paraguay Paraguay ,The Republic of Paraguay ,UN member state ,PY 
Peru Peru ,The Republic of Perú ,UN member state ,PE 
Philippines Philippines (the) ,The Republic of the Philippines ,UN member state ,PH 
Poland Poland ,The Republic of Poland ,UN member state ,PL 
Portugal Portugal ,The Portuguese Republic ,UN member state ,PT 
Qatar Qatar ,The State of Qatar ,UN member state ,QA 
Romania Romania ,Romania ,UN member state ,RO 
Russia Russian Federation (the) [w] ,The Russian Federation ,UN member state ,RU 
Rwanda Rwanda ,The Republic of Rwanda ,UN member state ,RW 
Saint Kitts and Nevis Saint Kitts and Nevis ,Saint Kitts and Nevis ,UN member state ,KN 
Saint Lucia Saint Lucia ,Saint Lucia ,UN member state ,LC 
Saint Vincent and the Grenadines Saint Vincent and the Grenadines ,Saint Vincent and the Grenadines ,UN member state ,VC 
Samoa Samoa ,The Independent State of Samoa ,UN member state ,WS 
San Marino San Marino ,The Republic of San Marino ,UN member state ,SM 
São Tomé and Príncipe Sao Tome and Principe ,The Democratic Republic of São Tomé and Príncipe ,UN member state ,ST 
Saudi Arabia Saudi Arabia ,The Kingdom of Saudi Arabia ,UN member state ,SA 
Senegal Senegal ,The Republic of Senegal ,UN member state ,SN 
Serbia Serbia ,The Republic of Serbia ,UN member state ,RS 
Seychelles Seychelles ,The Republic of Seychelles ,UN member state ,SC 
Sierra Leone Sierra Leone ,The Republic of Sierra Leone ,UN member state ,SL 
Singapore Singapore ,The Republic of Singapore ,UN member state ,SG 
Slovakia Slovakia ,The Slovak Republic ,UN member state ,SK 
Slovenia Slovenia ,The Republic of Slovenia ,UN member state ,SI 
Solomon Islands Solomon Islands ,The Solomon Islands ,UN member state ,SB 
Somalia Somalia ,The Federal Republic of Somalia ,UN member state ,SO 
South Africa South Africa ,The Republic of South Africa ,UN member state ,ZA 
South Sudan South Sudan ,The Republic of South Sudan ,UN member state ,SS 
Spain Spain ,The Kingdom of Spain ,UN member state ,ES 
Sri Lanka Sri Lanka ,The Democratic Socialist Republic of Sri Lanka ,UN member state ,LK 
Sudan Sudan (the) ,The Republic of the Sudan ,UN member state ,SD 
Suriname Suriname ,The Republic of Suriname ,UN member state ,SR 
Sweden Sweden ,The Kingdom of Sweden ,UN member state ,SE 
Switzerland Switzerland ,The Swiss Confederation ,UN member state ,CH 
Syria Syrian Arab Republic (the) [y] ,The Syrian Arab Republic ,UN member state ,SY 
Tajikistan Tajikistan ,The Republic of Tajikistan ,UN member state ,TJ 
"Tanzania Tanzania, the United Republic of ",The United Republic of Tanzania ,UN member state ,TZ 
Thailand Thailand ,The Kingdom of Thailand ,UN member state ,TH 
East Timor Timor-Leste [ab] ,The Democratic Republic of Timor-Leste ,UN member state ,TL 
Togo Togo ,The Togolese Republic ,UN member state ,TG 
Tonga Tonga ,The Kingdom of Tonga ,UN member state ,TO 
Trinidad and Tobago Trinidad and Tobago ,The Republic of Trinidad and Tobago ,UN member state ,TT 
Tunisia Tunisia ,The Republic of Tunisia ,UN member state ,TN 
Turkey Türkiye [ac] ,The Republic of Türkiye ,UN member state ,TR 
Turkmenistan Turkmenistan ,Turkmenistan ,UN member state ,TM 
Tuvalu Tuvalu ,Tuvalu ,UN member state ,TV 
Uganda Uganda ,The Republic of Uganda ,UN member state ,UG 
Ukraine Ukraine ,Ukraine ,UN member state ,UA 
United Arab Emirates United Arab Emirates (the) ,The United Arab Emirates ,UN member state ,AE 
United Kingdom United Kingdom of Great Britain and Northern Ireland (the) ,The United Kingdom of Great Britain and Northern Ireland ,UN member state ,GB 
United States United States of America (the) ,The United States of America ,UN member state ,US 
Uruguay Uruguay ,The Oriental Republic of Uruguay ,UN member state ,UY 
Uzbekistan Uzbekistan ,The Republic of Uzbekistan ,UN member state ,UZ 
Vanuatu Vanuatu ,The Republic of Vanuatu ,UN member state ,VU 
Venezuela Venezuela (Bolivarian Republic of) ,The Bolivarian Republic of Venezuela ,UN member state ,VE 
Vietnam Viet Nam [ag] ,The Socialist Republic of Viet Nam ,UN member state ,VN 
Yemen Yemen ,The Republic of Yemen ,UN member state ,YE 
Zambia Zambia ,The Republic of Zambia ,UN member state ,ZM 
Zimbabwe Zimbabwe ,The Republic of Zimbabwe ,UN member state ,ZW 
